{
  "schema_version": "1.0",
  "generated_at": "2026-08-23T00:00:00Z",
  "vault_root": "/Users/sab-mini/Obsidian/SSD",
  "nodes": [
    {
      "id": "root:ssd",
      "type": "root",
      "label": "SSD vault",
      "frontmatter": {
        "title": "AGENTS",
        "tags": [],
        "type": "root",
        "dates": { "created": "2026/05/24, 00:05:30", "modified": "2026/05/24, 01:05:56" },
        "model": null,
        "path": "/Users/sab-mini/Obsidian/SSD/AGENTS.md"
      }
    },
    {
      "id": "hub:projects",
      "type": "hub",
      "label": "01 Projects",
      "frontmatter": {
        "title": "AGENTS",
        "tags": [],
        "type": "hub",
        "dates": { "created": "2026/06/18, 00:00:00", "modified": "2026/06/18, 00:00:00" },
        "model": null,
        "path": "/Users/sab-mini/Obsidian/SSD/01 Projects/AGENTS.md"
      }
    },
    {
      "id": "hub:areas",
      "type": "hub",
      "label": "02 Areas",
      "frontmatter": {
        "title": "02 Areas",
        "tags": [],
        "type": "hub",
        "dates": { "created": null, "modified": null },
        "model": null,
        "path": "/Users/sab-mini/Obsidian/SSD/02 Areas"
      }
    },
    {
      "id": "hub:inbox",
      "type": "hub",
      "label": "00 Inbox",
      "frontmatter": {
        "title": "00 Inbox",
        "tags": [],
        "type": "hub",
        "dates": { "created": null, "modified": null },
        "model": null,
        "path": "/Users/sab-mini/Obsidian/SSD/00 Inbox"
      }
    },
    {
      "id": "hub:dispatch",
      "type": "hub",
      "label": "_dispatch",
      "frontmatter": {
        "title": "tasks",
        "tags": [],
        "type": "hub",
        "dates": { "created": "2026/04/30, 14:04:58", "modified": "2026/05/02, 13:05:39" },
        "model": null,
        "path": "/Users/sab-mini/Obsidian/SSD/_dispatch/tasks.md"
      }
    },
    {
      "id": "skill:loop-breaker",
      "type": "skill",
      "label": "loop-breaker",
      "frontmatter": {
        "title": "loop-breaker",
        "tags": ["pi-skill"],
        "type": "skill",
        "dates": { "created": null, "modified": null },
        "model": null,
        "path": "/Users/sab-mini/.pi/agent/skills/loop-breaker/SKILL.md"
      }
    },
    {
      "id": "artifact:rebuilds-anchor",
      "type": "artifact",
      "label": "Rebuilds Anchor Note",
      "frontmatter": {
        "title": "Rebuilds Anchor Note",
        "tags": ["rebuild"],
        "type": "artifact",
        "dates": { "created": "2026/01/11, 04:01:45", "modified": "2026/07/09, 17:07:34" },
        "model": null,
        "path": "/Users/sab-mini/Obsidian/SSD/01 Projects/Rebuilds/Rebuilds Anchor Note.md"
      }
    },
    {
      "id": "artifact:pi-obs-hub",
      "type": "artifact",
      "label": "Pi observability hub MVP",
      "frontmatter": {
        "title": "Pi observability hub MVP ready for Pi delegation and parallel work",
        "tags": [],
        "type": "artifact",
        "dates": { "created": "2026/06/22, 18:06:45", "modified": "2026/06/24, 02:06:37" },
        "model": null,
        "path": "/Users/sab-mini/Obsidian/SSD/01 Projects/Pi observability hub MVP ready for Pi delegation and parallel work.md"
      }
    },
    {
      "id": "routine:hermes-jobs",
      "type": "routine",
      "label": "hermes jobs.json",
      "frontmatter": {
        "title": "hermes cron jobs",
        "tags": ["hermes", "cron"],
        "type": "routine",
        "dates": { "created": null, "modified": null },
        "model": null,
        "path": "/Users/sab-mini/.hermes/cron/jobs.json"
      }
    },
    {
      "id": "app:pi-dispatch",
      "type": "app",
      "label": "pi-dispatch",
      "frontmatter": {
        "title": "Pi Dispatch Queue",
        "tags": ["dispatch"],
        "type": "app",
        "dates": { "created": "2026/04/30, 14:04:58", "modified": "2026/05/02, 13:05:39" },
        "model": null,
        "path": "/Users/sab-mini/Obsidian/SSD/_dispatch/tasks.md"
      }
    }
  ],
  "edges": [
    { "from": "root:ssd", "to": "hub:projects", "kind": "parent_child" },
    { "from": "root:ssd", "to": "hub:areas", "kind": "parent_child" },
    { "from": "root:ssd", "to": "hub:inbox", "kind": "parent_child" },
    { "from": "root:ssd", "to": "hub:dispatch", "kind": "parent_child" },
    { "from": "hub:projects", "to": "artifact:rebuilds-anchor", "kind": "router_leaf" },
    { "from": "hub:projects", "to": "artifact:pi-obs-hub", "kind": "router_leaf" },
    { "from": "root:ssd", "to": "skill:loop-breaker", "kind": "router_leaf" },
    { "from": "root:ssd", "to": "routine:hermes-jobs", "kind": "router_leaf" },
    { "from": "hub:dispatch", "to": "app:pi-dispatch", "kind": "router_leaf" }
  ]
}
